Aligning Extraction and Generation for Robust Retrieval-Augmented Generation,"Song, Hwanjun and Choi, Jeonghwan and Kim, Minseok",WSDM,2026,"Retrieval-augmented generation (RAG) enhances LLMs with external knowledge, yet generation remains vulnerable to retrieval-induced noise and uncertain placement of relevant chunks, often causing hallucinations. We present Ext2Gen, an extract-then-generate framework that strengthens LLMs via joint evidence selection and answer generation, dynamically identifying query-relevant content while suppressing noise, thereby removing the need for any independent pre-generation compression module. Optimized through preference alignment with well-curated pairwise feedback, Ext2Gen produces accurate and faithful answers even under noisy or imprecise retrieval. Experiments demonstrate that it substantially enhances the robustness of the generation backbone and yields greater performance gains than methods relying on independent compression models, (e.g., Recomp, CompAct, EXIT). It further benefits from improved retrieval techniques such as query rewriting, underscoring that generation-side enhancements address limitations that retrieval alone cannot overcome.",https://doi.org/10.1145/3773966.3777939,"rag, qa, robustness generation, preference alignment"
Fast-DataShapley: Neural Modeling for Training Data Valuation,"Sun, Haifeng and Xiong, Yu and Wu, Runze and Cai, Xinyu and Fan, Changjie and Zhang, Lan and Li, Xiang-Yang",WSDM,2026,"The value and copyright of training data are crucial in the artificial intelligence industry. Service platforms should protect data providers' legitimate rights and fairly reward them for their contributions. Shapley value, a potent tool for evaluating contributions, outperforms other methods in theory, but its computational overhead escalates exponentially with the number of data providers. Recent studies on Shapley values have proposed various approximation algorithms to address the computational complexity issues inherent in exact calculations. However, they need to retrain for each test sample, leading to intolerable costs. We propose Fast-DataShapley, a one-pass training framework that leverages the weighted least squares characterization of the Shapley value to train a reusable explainer model with real-time reasoning speed. Given new test samples, no retraining is required to calculate the Shapley values of the training data. Additionally, we propose three methods with theoretical guarantees to reduce training overhead from two aspects: the approximate calculation of the utility function and the reduction of the sample space complexity. We analyze time complexity to show the efficiency of our methods. The experimental evaluations on various image datasets demonstrate superior performance and efficiency compared to baselines. Specifically, the performance is improved to more than 2\texttimes{}, and the explainer's training speed can be increased by two orders of magnitude.",https://doi.org/10.1145/3773966.3777937,"shapley value, data attribution, training data valuation"
Diversification as Risk Minimization,"Takehi, Rikiya and Diaz, Fernando and Sakai, Tetsuya",WSDM,2026,"Users tend to remember failures of a search session more than its many successes. This observation has led to work on search robustness, where systems are penalized if they perform very poorly on some queries. However, this principle of robustness has been overlooked within a single query. An ambiguous or underspecified query (e.g., ''jaguar'') can have several user intents, where popular intents often dominate the ranking, leaving users with minority intents unsatisfied. Although the diversification literature has long recognized this issue, existing metrics only model the average relevance across intents and provide no robustness guarantees. More surprisingly, we show theoretically and empirically that many well-known diversification algorithms are no more robust than a naive, non-diversified algorithm. To address this critical gap, we propose to frame diversification as a risk-minimization problem. We introduce VRisk, which measures the expected risk faced by the least-served fraction of intents in a query. Optimizing VRisk produces a robust ranking, reducing the likelihood of poor user experiences. We then propose VRisker, a fast greedy re-ranker with provable approximation guarantees. Finally, experiments on NTCIR INTENT-2, TREC Web 2012, and MovieLens show the vulnerability of existing methods. VRisker reduces worst-case intent failures by up to 33\% with a minimal 2\% drop in average performance.",https://doi.org/10.1145/3773966.3777985,"information retrieval, search diversification, robustness, risk minimization, ranking, recommender systems"
Federated Watermarking of Deep Neural Networks with Distributed Verification,"Tseng, Sheng-Po and Yeh, Lo-Yao and Hung, Hui-Ju and Shen, Chih-Ya",WSDM,2026,"With the advancement of deep learning, DNNs have been widely deployed across diverse domains. Model-as-a-Service (MaaS) platforms allow enterprises to commercialize well-trained models, which are built through extensive data collection and substantial computational investment. Consequently, protecting these models from unauthorized use and intellectual property (IP) theft has become critical. While watermarking has emerged as a prominent IP protection technique, most existing approaches target centralized settings, leaving federated learning (FL) scenarios largely underexplored. To bridge this gap, we propose Federated Watermarking with Distributed Verification (FWDV), a novel framework tailored for FL. FWDV enables each client to independently verify watermark ownership and jointly defend the model against erasure attempts. To our knowledge, this is the first work to achieve both distributed verification and robustness against a broad spectrum of attacks. Extensive experiments demonstrate that FWDV embeds watermarks with minimal impact on model utility and resists removal through fine-tuning, pruning, and distillation.",https://doi.org/10.1145/3773966.3777930,"federated learning, deep neural network watermarking, model ownership, intellectual property"
Adaptive Continual Learning with User-Incremental Forward Compatibility for Meta-Augmented Cold-Start Recommenders,"Wang, Chunyang and Zhao, Xuhao and Ma, Wenze and Wang, Zhaobo and Zhu, Yanmin and Liu, Haobing",WSDM,2026,"User cold-start remains a long-standing challenge to recommendation systems due to the scarce interactions of new users. By enabling user-adaptive model customization, meta-augmented cold-start recommenders have shown significant capacity for fast adaptation to few-shot interaction records. Despite demonstrating promising generalization for new users, non-stationarity of user preference dynamics necessitates continuous model adaptation of cold-start recommenders under dynamic streaming environments. Our work focuses on User-Incremental Learning (User-IL) paradigm, specifically investigating how to effectively assimilate novel preferences of new users arriving in continual periods while preserving common preference patterns extracted for cold-start recommendation. By comparison with visual class-incremental learning, we highlight the essential necessity of forward compatibility in user-incremental learning. To this end, we propose an adaptive incremental learning approach for meta-augmented cold-start recommenders, namely IncMCR, and improve meta-knowledge evolution with dual-view forward compatibility adaptation. To combat meta-knowledge erosion, we design complementary-oriented meta-task replay with prototype-aware exemplar selection. Then, to strengthen the sensitivity of preference assimilation at each incremental retraining period, we design a novelty-sensitive meta-updater by modifying the vanilla meta-learning with adaptive meta-weighting. Extensive experiments conducted on three real-world datasets demonstrate the effectiveness of IncMCR and also show its robustness to both short-term and long-term user-increments.",https://doi.org/10.1145/3773966.3777949,"cold-start recommendation, meta-learning, continual learning"
DGNet: Enhancing Parallel CTR Prediction Models via Decoupled Gated Network: Enhancing Parallel CTR Prediction Models via Decoupled Gated Network,"Wang, Fangye and Yan, Xiaoran",WSDM,2026,"Click-through rate (CTR) prediction is a cornerstone of modern recommender systems and online advertising platforms. Parallel CTR models utilize multiple sub-networks to capture diverse feature interactions and achieve advanced performance. However, these models face two key limitations: (1) reliance on shared, static feature embeddings limits their ability to capture distinct interaction signals across parallel sub-networks; and (2) although effective for modeling high-order interactions, the conventional layer-by-layer interaction paradigm propagates and amplifies noise cumulatively, thereby reducing model robustness. To address these challenges, we propose Decoupled Gated Network (DGNet), a novel framework that introduces two key components: Decoupled Embedding Generator (DEG) adaptively generates sub-network-specific embeddings from original representations, enhancing interaction specificity. Gated Fusion Module (GateF) dynamically extracts layer-wise complementary information from decoupled embeddings to mitigate cumulative interaction noise. DGNet and its two components are model-agnostic and can be seamlessly integrated into existing parallel CTR models. Extensive experiments show that DGNet consistently improves the performance of various parallel CTR models, yielding statistically significant performance boosting. Meanwhile, visualization and quantitative analyses provide an intuitively explanation for its reliability and performance improvements.",https://doi.org/10.1145/3773966.3777918,"decoupled embedding, gated fusion, representation learning, ctr prediction"
Fairness-aware PageRank via Edge Reweighting,"Wang, Honglian and Zhou, Haoyun and Gionis, Aristides",WSDM,2026,"Link-analysis algorithms, such as PageRank, are instrumental in understanding the structural dynamics of networks by evaluating the importance of individual vertices based on their connectivity. Recently, with the rising importance of responsible AI, the question of fairness in link-analysis algorithms has gained traction.In this paper, we present a new approach for incorporating group fairness into the PageRank algorithm by reweighting the transition probabilities in the underlying transition matrix. We formulate the problem of achieving fair PageRank by seeking to minimize the fairness loss, which is the difference between the original group-wise PageRank distribution and a target PageRank distribution. We further define a group-adapted fairness notion, which accounts for group homophily by considering random walks with group-biased restart for each group. Since the fairness loss is non-convex, we propose an efficient projected gradient-descent method for computing locally-optimal edge weights. Unlike earlier approaches, we do not recommend adding new edges to the network, nor do we adjust the restart vector. Instead, we keep the topology of the underlying network unchanged and only modify the relative importance of existing edges. We empirically compare our approach with state-of-the-art baselines and demonstrate the efficacy of our method, where very small changes in the transition matrix lead to significant improvement in the fairness of the PageRank algorithm.",https://doi.org/10.1145/3773966.3777991,"link analysis, pagerank, graph analysis, fairness"
NILC: Discovering New Intents with LLM-assisted Clustering,"Wang, Hongtao and Yang, Renchi and Lin, Wenqing",WSDM,2026,"New intent discovery (NID) seeks to recognize both new and known intents from unlabeled user utterances, which finds prevalent use in practical dialogue systems. Existing works towards NID mainly adopt a cascaded architecture, wherein the first stage focuses on encoding the utterances into informative text embeddings beforehand, while the latter is to group similar embeddings into clusters (i.e., intents), typically by K-Means. However, such a cascaded pipeline fails to leverage the feedback from both steps for mutual refinement, and, meanwhile, the embedding-only clustering overlooks nuanced textual semantics, leading to suboptimal performance.  To bridge this gap, this paper proposes NILC, a novel clustering framework specially catered for effective NID. Particularly, NILC follows an iterative workflow, in which clustering assignments are judiciously updated by carefully refining cluster centroids and text embeddings of uncertain utterances with the aid of large language models (LLMs). Specifically, NILC first taps into LLMs to create additional semantic centroids for clusters, thereby enriching the contextual semantics of the Euclidean centroids of embeddings. Moreover, LLMs are then harnessed to augment hard samples (ambiguous or terse utterances) identified from clusters via rewriting for subsequent cluster correction. Further, we inject supervision signals through non-trivial techniques seeding and soft must links for more accurate NID in the semi-supervised setting. Extensive experiments comparing NILC against multiple recent baselines under both unsupervised and semi-supervised settings showcase that NILC can achieve significant performance improvements over six benchmark datasets of diverse domains consistently.",https://doi.org/10.1145/3773966.3777979,"intent discovery, clustering, large language models"
Proficient Graph Neural Network Design by Accumulating Knowledge on Large Language Models,"Wang, Jialiang and Liu, Hanmo and Di, Shimin and Wang, Zhili and Wang, Jiachuan and Chen, Lei and Zhou, Xiaofang",WSDM,2026,"High-level automation is increasingly critical in AI, driven by rapid advances in large language models (LLMs) and AI agents. However, LLMs, despite their general reasoning power, struggle significantly in specialized, data-sensitive tasks such as designing Graph Neural Networks (GNNs). This difficulty arises from (1) the inherent knowledge gaps in modeling the intricate, varying relationships between graph properties and suitable architectures and (2) the external noise from misleading descriptive inputs, often resulting in generic or even misleading model suggestions. Achieving proficiency in designing data-aware models—defined as the meta-level capability to systematically accumulate, interpret, and apply data-specific design knowledge—remains challenging for existing automated approaches, due to their inefficient construction and application of meta-knowledge. To achieve meta-level proficiency, we propose DesiGNN, a knowledge-centered framework that systematically converts past model design experience into structured, fine-grained knowledge priors well-suited for meta-learning with LLMs. To account for the inherent variability and external noise, DesiGNN aligns empirical property filtering from extensive benchmarks with adaptive elicitation of literature insights via LLMs. By constructing a solid meta-knowledge between unseen graph understanding and known effective architecture patterns, DesiGNN can deliver top-5.77\% initial model proposals for unseen datasets within seconds and achieve consistently superior performance with minimal search cost compared to baselines.",https://doi.org/10.1145/3773966.3777982,"neural architecture search, graph neural networks, large language models"
EvioSum: An Evidence-Guided Generation Framework for Faithful and Interpretable Opinion Summarization,"Wang, Jian and Liang, Yanjie and Sun, Yuqing and Gong, Bin",WSDM,2026,"The faithful and interpretable opinion summarization aims to generate a summary that captures the diverse opinions expressed in a document set while providing explanations for the divergences between these opinions. In this paper, we propose an evidence-guided framework to enhance opinion coverage and provide divergence explanations. It first generates the majority opinion as an initial summary and partitions the source documents into multiple evidence sets based on their relevance to the majority opinion. Then, a summary extension strategy is employed to expand the initial summary by incorporating different opinions from these sets. The framework also employs a submodular optimization algorithm to select evidence from different evidence sets in order to reflect the divergences between opinions. Experiments on two benchmark datasets demonstrate that our method outperforms multiple baselines in terms of both the lexical and semantic consistency with reference summaries, while having low computational overhead.Ablation studies confirm that both the document partition and summary extension mechanisms contribute to the model performance.The LLM-based and human evaluation results also show that our method can identify more comprehensive evidence that better captures opinion divergences.",https://doi.org/10.1145/3773966.3777962,"faithful opinion summarization, interpretable, evidence, aspects"
SARC: Sentiment-Augmented Deep Role Clustering for Fake News Detection,"Wang, Jingqing and Shang, Jiaxing and Xu, Rong and Hao, Fei and Huang, Tianjin and Min, Geyong",WSDM,2026,"Fake news detection has been a long-standing research focus in social networks. Recent studies suggest that incorporating sentiment information from both news content and user comments can enhance detection performance. However, existing approaches typically treat sentiment features as auxiliary signals, overlooking role differentiation, that is, the same sentiment polarity may originate from users with distinct roles, thereby limiting their ability to capture nuanced patterns for effective detection. To address this issue, we propose SARC, a Sentiment-Augmented Role Clustering framework which utilizes sentiment-enhanced deep clustering to identify user roles for improved fake news detection. The framework first generates user features through joint comment text representation (with BiGRU and Attention mechanism) and sentiment encoding. It then constructs a differentiable deep clustering module to automatically categorize user roles. Finally, unlike existing approaches which take fake news label as the unique supervision signal, we propose a joint optimization objective integrating role clustering and fake news detection to further improve the model performance. Experimental results on two benchmark datasets, RumourEval-19 and Weibo-comp, demonstrate that SARC achieves superior performance across all metrics compared to baseline models. The code is available at: https://github.com/jxshang/SARC.",https://doi.org/10.1145/3773966.3777976,"fake news detection, user sentiment, deep clustering, social networks"
Taming Non-Stationary Knowledge Growth: Dynamic Global Memory Framework for Lifelong Knowledge Graph Embedding,"Wang, Ling and Liu, Yan and Lu, Jicang and Guo, Xiaoyu and Li, Zhipeng and Huang, Ningbo",WSDM,2026,"Dynamic knowledge graphs exhibit non-stationary growth characterized by three key features: heterogeneous structural connectivity, variable growth frequency and magnitude, and scale-semantic imbalance. Existing lifelong knowledge graph embedding methods, based on the assumption of stationary growth, hardly consider all these features, resulting in unsatisfactory embedding performance. Specifically, heterogeneous connectivity leads to inefficient knowledge transfer and embedding initialization bias; frequent, large growths cause catastrophic forgetting and embedding space drift; fixed strategies fail to prioritize high-value knowledge, thereby degrading long-term retention. To tackle these issues, we propose DyGM (Dynamic Global Memory Framework), a novel framework integrating three core components. The connectivity-aware structuring module leverages topological metrics, to enable reliable structural ordering and knowledge transfer. The cross-snapshot relay module preserves long-term knowledge through instance-level replay and feature-level distillation. The dynamic weight balancing mechanism adaptively adjusts the importance of historical and new knowledge, to prioritize core information during training and ensure stable retention of core structural-semantic dependencies. We construct two non-stationary KG datasets and conduct extensive experiments on both stationary and non-stationary datasets. Experimental results demonstrate that DyGM achieves competitive performance on stationary datasets and significantly outperforms on non-stationary datasets.",https://doi.org/10.1145/3773966.3777936,"knowledge graph, lifelong learning, non-stationary, global memory"
TemporalExpertNet: Cross-Temporal Knowledge Reuse for Promotion-Aware CVR Prediction,"Wang, Minmao and Zhang, Rui and Yi, Shijie and Wu, Likang and Zhao, Hongke and Pan, Fei and Cai, Qingpeng and Jiang, Peng",WSDM,2026,"Major promotional events such as Black Friday and 618 Shopping Day cause drastic, heterogeneous shifts in user and advertiser behavior, posing persistent challenges for conversion rate (CVR) models trained on daily data. Existing methods often lack the flexibility to capture this periodic variability, resulting in poor modeling of diverse behavioral patterns. To address these challenges, we propose TemporalExpertNet(TEN), a cross-temporal transfer learning framework for industrial-scale CVR prediction during promotion cycles. TEN decomposes the model into a stable representation encoder and a promotion-sensitive expert, enabling reusable temporal knowledge transfer. Specifically, we propose BridgeNet to address the mismatch between historical knowledge and current features through temporal representation alignment. We further introduce TemporalExpertGate (TEG) to perform sample-aware expert fusion, enabling fine-grained prediction adjustment and adaptive knowledge reuse across promotion periods. By using a two-stage training strategy, TEN achieves stable alignment and adaptive expert fusion for robust prediction under shifting promotional distributions. TEN was deployed on a large-scale short-video ads platform during the 618 preheating phase, improving conversion rate by 7.52\% and platform RPM by 4.27\% with only 0.23\% model size and 1.8\% latency overhead. It was therefore fully launched to all traffic on 618 Shopping Day, bringing substantial commercial gains.",https://doi.org/10.1145/3773966.3777956,"cvr prediction in promotional scenarios, transfer learning, recommender systems"
OneLoc: Geo-Aware Generative Recommender Systems for Local Life Service,"Wei, Zhipeng and Cai, Kuo and She, Junda and Chen, Jie and Chen, Minghao and Zeng, Yang and Luo, Qiang and Zeng, Wencong and Tang, Ruiming and Gai, Kun and Zhou, Guorui",WSDM,2026,"Local life service is a vital scenario in Kuaishou App, in which we recommend videos with stores' location information. Thus, recommendation in our scenario is challenging because we should take into account user's interest and real-time location at the same time. In complex scenarios, end-to-end generative recommendation has emerged as a new paradigm, such as OneRec in the short video scenario, OneSug in the search scenario, and EGA in the advertising scenario. However, in local life service, an end-to-end generative recommendation model has not yet been developed as there are some key challenges to be solved. The first challenge is how to make full use of geographic information. The second challenge is how to balance multiple objectives, including user interests, the distance between user and stores, and some other business objectives. To address the challenges, we propose OneLoc. Specifically, we leverage geographic information from different perspectives: (1) geo-aware semantic ID incorporates both video and geographic information for tokenization, (2) geo-aware attention injects video location similarity and user's real-time location in the encoder, and (3) neighbor-aware prompt captures rich context information surrounding users for generation. To balance multiple objectives, we use reinforcement learning and propose a geographic reward and a GMV reward. With the above design, OneLoc achieves outstanding offline and online performance. In fact, OneLoc has been deployed in local life service of Kuaishou App and achieved 21.016\% and 17.891\% improvements in terms of gross merchandise value (GMV) and orders numbers.",https://doi.org/10.1145/3773966.3777963,"location-based recommendation, generative recommendation, large language model"
