Title,Author,Conference Name (Book Title),Year,Abstract,url,Keywords,Source_File
Personalized re-ranking for recommendation,"Pei, Changhua and Zhang, Yi and Zhang, Yongfeng and Sun, Fei and Lin, Xiao and Sun, Hanxiao and Wu, Jian and Jiang, Peng and Ge, Junfeng and Ou, Wenwu and Pei, Dan",RECSYS,2019,"Ranking is a core task in recommender systems, which aims at providing an ordered list of items to users. Typically, a ranking function is learned from the labeled dataset to optimize the global performance, which produces a ranking score for each individual item. However, it may be sub-optimal because the scoring function applies to each item individually and does not explicitly consider the mutual influence between items, as well as the differences of users' preferences or intents. Therefore, we propose a personalized re-ranking model for recommender systems. The proposed re-ranking model can be easily deployed as a follow-up modular after any ranking algorithm, by directly using the existing ranking feature vectors. It directly optimizes the whole recommendation list by employing a transformer structure to efficiently encode the information of all items in the list. Specifically, the Transformer applies a self-attention mechanism that directly models the global relationships between any pair of items in the whole list. We confirm that the performance can be further improved by introducing pre-trained embedding to learn personalized encoding functions for different users. Experimental results on both offline benchmarks and real-world online e-commerce systems demonstrate the significant improvements of the proposed re-ranking model.",https://doi.org/10.1145/3298689.3347000,"learning to rank, re-ranking, recommendation",recsys2019.bib
Online ranking combination,"Frig\'{o}, Erzs\'{e}bet and Kocsis, Levente",RECSYS,2019,"As a task of high importance for recommender systems, we consider the problem of learning the convex combination of ranking algorithms by online machine learning. In the case of two base rankers, we show that the exponentially weighted combination achieves near optimal performance. However, the number of required points to be evaluated may be prohibitive with more base models in a real application. We propose a gradient based stochastic optimization algorithm that uses finite differences. Our new algorithm achieves similar empirical performance for two base rankers, while scaling well with an increased number of models. In our experiments with five real-world recommendation data sets, we show that the combination offers significant improvement over previously known stochastic optimization techniques. Our algorithm is the first effective stochastic optimization method for combining ranked recommendation lists by online machine learning.",https://doi.org/10.1145/3298689.3346993,"RFDSA, combination, ranking",recsys2019.bib
A pareto-efficient algorithm for multiple objective optimization in e-commerce recommendation,"Lin, Xiao and Chen, Hongjie and Pei, Changhua and Sun, Fei and Xiao, Xuanji and Sun, Hanxiao and Zhang, Yongfeng and Ou, Wenwu and Jiang, Peng",RECSYS,2019,"Recommendation with multiple objectives is an important but difficult problem, where the coherent difficulty lies in the possible conflicts between objectives. In this case, multi-objective optimization is expected to be Pareto efficient, where no single objective can be further improved without hurting the others. However existing approaches to Pareto efficient multi-objective recommendation still lack good theoretical guarantees.In this paper, we propose a general framework for generating Pareto efficient recommendations. Assuming that there are formal differentiable formulations for the objectives, we coordinate these objectives with a weighted aggregation. Then we propose a condition ensuring Pareto efficiency theoretically and a two-step Pareto efficient optimization algorithm. Meanwhile the algorithm can be easily adapted for Pareto Frontier generation and fair recommendation selection. We specifically apply the proposed framework on E-Commerce recommendation to optimize GMV and CTR simultaneously. Extensive online and offline experiments are conducted on the real-world E-Commerce recommender system and the results validate the Pareto efficiency of the framework.To the best of our knowledge, this work is among the first to provide a Pareto efficient framework for multi-objective recommendation with theoretical guarantees. Moreover, the framework can be applied to any other objectives with differentiable formulations and any model with gradients, which shows its strong scalability.",https://doi.org/10.1145/3298689.3346998,"learning to rank, multiple obecjtive optimization, pareto efficiency, recommendation",recsys2019.bib
From preference into decision making: modeling user interactions in recommender systems,"Zhao, Qian and Willemsen, Martijn C. and Adomavicius, Gediminas and Harper, F. Maxwell and Konstan, Joseph A.",RECSYS,2019,"User-system interaction in recommender systems involves three aspects: temporal browsing (viewing recommendation lists and/or searching/filtering), action (performing actions on recommended items, e.g., clicking, consuming) and inaction (neglecting or skipping recommended items). Modern recommenders build machine learning models from recordings of such user interaction with the system, and in doing so they commonly make certain assumptions (e.g., pairwise preference orders, independent or competitive probabilistic choices, etc.). In this paper, we set out to study the effects of these assumptions along three dimensions in eight different single models and three associated hybrid models on a user browsing data set collected from a real-world recommender system application. We further design a novel model based on recurrent neural networks and multi-task learning, inspired by Decision Field Theory, a model of human decision making. We report on precision, recall, and MAP, finding that this new model outperforms the others.",https://doi.org/10.1145/3298689.3347065,"decision field theory, decision making, recurrent neural networks",recsys2019.bib
Deep generative ranking for personalized recommendation,"Liu, Huafeng and Wen, Jingxuan and Jing, Liping and Yu, Jian",RECSYS,2019,"Recommender systems offer critical services in the age of mass information. Personalized ranking has been attractive both for content providers and customers due to its ability of creating a user-specific ranking on the item set. Although the powerful factor-analysis methods including latent factor models and deep neural network models have achieved promising results, they still suffer from the challenging issues, such as sparsity of recommendation data, uncertainty of optimization, and etc. To enhance the accuracy and generalization of recommender system, in this paper, we propose a deep generative ranking (DGR) model under the Wasserstein autoencoder framework. Specifically, DGR simultaneously generates the pointwise implicit feedback data (via a Beta-Bernoulli distribution) and creates the pairwise ranking list by sufficient exploiting both interacted and non-interacted items for each user. DGR can be efficiently inferred by minimizing its penalized evidence lower bound. Meanwhile, we theoretically analyze the generalization error bounds of DGR model to guarantee its performance in extremely sparse feedback data. A series of experiments on four large-scale datasets (Movielens (20M), Netflix, Epinions and Yelp in movie, product and business domains) have been conducted. By comparing with the state-of-the-art methods, the experimental results demonstrate that DGR consistently benefit the recommendation system in ranking estimation task, especially for the near-cold-start-users (with less than five interacted items).",https://doi.org/10.1145/3298689.3347012,"Bayesian graphical model, deep generative model, personalized recommendation",recsys2019.bib
Recommending what video to watch next: a multitask ranking system,"Zhao, Zhe and Hong, Lichan and Wei, Li and Chen, Jilin and Nath, Aniruddh and Andrews, Shawn and Kumthekar, Aditee and Sathiamoorthy, Maheswaran and Yi, Xinyang and Chi, Ed",RECSYS,2019,"In this paper, we introduce a large scale multi-objective ranking system for recommending what video to watch next on an industrial video sharing platform. The system faces many real-world challenges, including the presence of multiple competing ranking objectives, as well as implicit selection biases in user feedback. To tackle these challenges, we explored a variety of soft-parameter sharing techniques such as Multi-gate Mixture-of-Experts so as to efficiently optimize for multiple ranking objectives. Additionally, we mitigated the selection biases by adopting a Wide \&amp; Deep framework. We demonstrated that our proposed techniques can lead to substantial improvements on recommendation quality on one of the world's largest video sharing platforms.",https://doi.org/10.1145/3298689.3346997,"multitask learning, recommendation and ranking, selection bias",recsys2019.bib
Users in the loop: a psychologically-informed approach to similar item retrieval,"Winecoff, Amy A. and Brasoveanu, Florin and Casavant, Bryce and Washabaugh, Pearce and Graham, Matthew",RECSYS,2019,"Recommender systems (RS) often leverage information about the similarity between items' features to make recommendations. Yet, many commonly used similarity functions make mathematical assumptions such as symmetry (i.e., Sim(a, b) = Sim(b, a)) that are inconsistent with how humans make similarity judgments. Moreover, most algorithm validations either do not directly measure users' behavior or fail to comply with methodological standards for psychological research. RS that are developed and evaluated without regard to users' psychology may fail to meet users' needs. To provide recommendations that do meet the needs of users, we must: 1) develop similarity functions that account for known properties of human cognition, and 2) rigorously evaluate the performance of these functions using methodologically sound user testing. Here, we develop a framework for evaluating users' judgments of similarity that is informed by best practices in psychological research methods. Employing users' fashion item similarity judgments collected using our framework, we demonstrate that a psychologically-informed similarity function (i.e., Tversky contrast model) outperforms a psychologically-naive similarity function (i.e., Jaccard similarity) in predicting users' similarity judgments.",https://doi.org/10.1145/3298689.3347047,"item retrieval, psychology, similarity, user research",recsys2019.bib
Explaining and exploring job recommendations: a user-driven approach for interacting with knowledge-based job recommender systems,"Guti\'{e}rrez, Francisco and Charleer, Sven and De Croon, Robin and Htun, Nyi Nyi and Goetschalckx, Gerd and Verbert, Katrien",RECSYS,2019,"The dynamics of the labor market and the tasks with which jobs are being composed are continuously evolving. Job mobility is not evident, and providing effective recommendations in this context has also been found to be particularly challenging. In this paper, we present Labor Market Explorer, an interactive dashboard that enables job seekers to explore the labor market in a personalized way based on their skills and competences. Through a user-centered design process involving job seekers and job mediators, we developed this dashboard to enable job seekers to explore job recommendations and their required competencies, as well as how these competencies map to their profile. Evaluation results indicate the dashboard empowers job seekers to explore, understand, and find relevant vacancies, mostly independent of their background and age.",https://doi.org/10.1145/3298689.3347001,"actionable insights, explanations, personal characteristics, recommender systems, user control",recsys2019.bib
Designing for the better by taking users into account: a qualitative evaluation of user control mechanisms in (news) recommender systems,"Harambam, Jaron and Bountouridis, Dimitrios and Makhortykh, Mykola and van Hoboken, Joris",RECSYS,2019,"Recommender systems (RS) are on the rise in many domains. While they offer great promises, they also raise concerns: lack of transparency, reduction of diversity, little to no user control. In this paper, we align with the normative turn in computer science which scrutinizes the ethical and societal implications of RS. We focus and elaborate on the concept of user control because that mitigates multiple problems at once. Taking the news industry as our domain, we conducted four focus groups, or moderated think-aloud sessions, with Dutch news readers (N=21) to systematically study how people evaluate different control mechanisms (at the input, process, and output phase) in a News Recommender Prototype (NRP). While these mechanisms are sometimes met with distrust about the actual control they offer, we found that an intelligible user profile (including reading history and flexible preferences settings), coupled with possibilities to influence the recommendation algorithms is highly valued, especially when these control mechanisms can be operated in relation to achieving personal goals. By bringing (future) users' perspectives to the fore, this paper contributes to a richer understanding of why and how to design for user control in recommender systems.",https://doi.org/10.1145/3298689.3347014,"accuracy, diversity, ethics, filter bubble, qualitative research, recommender systems, self-actualization, transparency, user centered design, user control, user study",recsys2019.bib
Efficient privacy-preserving recommendations based on social graphs,"Wainakh, Aidmar and Grube, Tim and Daubert, J\""{o}rg and M\""{u}hlh\""{a}user, Max",RECSYS,2019,"Many recommender systems use association rules mining, a technique that captures relations between user interests and recommends new probable ones accordingly. Applying association rule mining causes privacy concerns as user interests may contain sensitive personal information (e.g., political views). This potentially even inhibits the user from providing information in the first place. Current distributed privacy-preserving association rules mining (PPARM) approaches use cryptographic primitives that come with high computational and communication costs, rendering PPARM unsuitable for large-scale applications such as social networks. We propose improvements in the efficiency and privacy of PPARM approaches by minimizing the required data. We propose and compare sampling strategies to sample the data based on social graphs in a privacy-preserving manner. The results on real-world datasets show that our sampling-based approach can achieve a high average precision score with as low as 50\% sampling rate and, therefore, with a 50\% reduction of communication cost.",https://doi.org/10.1145/3298689.3347013,"association rules, distributed data, efficiency, privacy-preserving data mining, recommender system",recsys2019.bib
PrivateJobMatch: a privacy-oriented deferred multi-match recommender system for stable employment,"Saini, Amar and Rusu, Florin and Johnston, Andrew",RECSYS,2019,"Coordination failure reduces match quality among employers and candidates in the job market, resulting in a large number of unfilled positions and/or unstable, short-term employment. Centralized job search engines provide a platform that connects directly employers with job-seekers. However, they require users to disclose a significant amount of personal data, i.e., build a user profile, in order to provide meaningful recommendations. In this paper, we present PrivateJobMatch - a privacy-oriented deferred multi-match recommender system - which generates stable pairings while requiring users to provide only a partial ranking of their preferences. PrivateJobMatch explores a series of adaptations of the game-theoretic Gale-Shapley deferred acceptance algorithm which combine the flexibility of decentralized markets with the intelligence of centralized matching. We identify the shortcomings of the original algorithm when applied to a job market and propose novel solutions that rely on machine learning techniques. Experimental results on real and synthetic data confirm the benefits of the proposed algorithms across several quality measures. Over the past year, we have implemented a PrivateJobMatch prototype and deployed it in an active job market economy. Using the gathered real-user preference data, we find that the match recommendations are superior to a typical decentralized job market---while requiring only a partial ranking of the user preferences.",https://doi.org/10.1145/3298689.3346983,"DAA algorithm, gale-shapley algorithm, job matching, low-rank matrix factorization, mmdaa algorithm, reciprocal matching",recsys2019.bib
User-centered evaluation of strategies for recommending sequences of points of interest to groups,"Herzog, Daniel and W\""{o}rndl, Wolfgang",RECSYS,2019,"Most recommender systems (RSs) predict the preferences of individual users; however, in certain scenarios, recommendations need to be made for a group of users. Tourism is a popular domain for group recommendations because people often travel in groups and look for point of interest (POI) sequences for their visits during a trip. In this study, we present different strategies that can be used to recommend POI sequences for groups. In addition, we introduce novel approaches, including a strategy called Split Group, which allows groups to split into smaller groups during a trip. We compared all strategies in a user study with 40 real groups. Our results proved that there was a significant difference in the quality of recommendations generated by using the different strategies. Most groups were willing to split temporarily during a trip, even when they were traveling with persons close to them. In this case, Split Group generated the best recommendations for different evaluation criteria. We use these findings to propose improvements for group recommendation strategies in the tourism domain.",https://doi.org/10.1145/3298689.3346988,"group recommendation, preference aggregation, recommender system, sequence, social choice strategy, user study",recsys2019.bib
Are we really making much progress? A worrying analysis of recent neural recommendation approaches,"Ferrari Dacrema, Maurizio and Cremonesi, Paolo and Jannach, Dietmar",RECSYS,2019,"Deep learning techniques have become the method of choice for researchers working on algorithmic aspects of recommender systems. With the strongly increased interest in machine learning in general, it has, as a result, become difficult to keep track of what represents the state-of-the-art at the moment, e.g., for top-n recommendation tasks. At the same time, several recent publications point out problems in today's research practice in applied machine learning, e.g., in terms of the reproducibility of the results or the choice of the baselines when proposing new models.In this work, we report the results of a systematic analysis of algorithmic proposals for top-n recommendation tasks. Specifically, we considered 18 algorithms that were presented at top-level research conferences in the last years. Only 7 of them could be reproduced with reasonable effort. For these methods, it however turned out that 6 of them can often be outperformed with comparably simple heuristic methods, e.g., based on nearest-neighbor or graph-based techniques. The remaining one clearly outperformed the baselines but did not consistently outperform a well-tuned non-neural linear ranking method. Overall, our work sheds light on a number of potential problems in today's machine learning scholarship and calls for improved scientific practices in this area.",https://doi.org/10.1145/3298689.3347058,"deep learning, evaluation, recommender systems, reproducibility",recsys2019.bib
A deep learning system for predicting size and fit in fashion e-commerce,"Sheikh, Abdul-Saboor and Guigour\`{e}s, Romain and Koriagin, Evgenii and Ho, Yuen King and Shirvany, Reza and Vollgraf, Roland and Bergmann, Urs",RECSYS,2019,"Personalized size and fit recommendations bear crucial significance for any fashion e-commerce platform. Predicting the correct fit drives customer satisfaction and benefits the business by reducing costs incurred due to size-related returns. Traditional collaborative filtering algorithms seek to model customer preferences based on their previous orders. A typical challenge for such methods stems from extreme sparsity of customer-article orders. To alleviate this problem, we propose a deep learning based content-collaborative methodology for personalized size and fit recommendation. Our proposed method can ingest arbitrary customer and article data and can model multiple individuals or intents behind a single account. The method optimizes a global set of parameters to learn population-level abstractions of size and fit relevant information from observed customer-article interactions. It further employs customer and article specific embedding variables to learn their properties. Together with learned entity embeddings, the method maps additional customer and article attributes into a latent space to derive personalized recommendations. Application of our method to two publicly available datasets demonstrate an improvement over the state-of-the-art published results. On two proprietary datasets, one containing fit feedback from fashion experts and the other involving customer purchases, we further outperform comparable methodologies, including a recent Bayesian approach for size recommendation.",https://doi.org/10.1145/3298689.3347006,"cold-start problem, collaborative filtering, entity embedding, personalization, recommendation, size and fit prediction",recsys2019.bib
Relaxed softmax for PU learning,"Tanielian, Ugo and Vasile, Flavian",RECSYS,2019,"In recent years, the softmax model and its fast approximations have become the de-facto loss functions for deep neural networks when dealing with multi-class prediction. This loss has been extended to language modeling and recommendation, two fields that fall into the framework of learning from Positive and Unlabeled data.In this paper, we stress the different drawbacks of the current family of softmax losses and sampling schemes when applied in a Positive and Unlabeled learning setup. We propose both a Relaxed Softmax loss (RS) and a new negative sampling scheme based on Boltzmann formulation. We show that the new training objective is better suited for the tasks of density estimation, item similarity and next-event prediction by driving uplifts in performance on textual and recommendation datasets against classical softmax.",https://doi.org/10.1145/3298689.3347034,"negative sampling, positive-unlabeled learning",recsys2019.bib
Style conditioned recommendations,"Iqbal, Murium and Aryafar, Kamelia and Anderton, Timothy",RECSYS,2019,"We propose Style Conditioned Recommendations (SCR) and introduce style injection as a method to diversify recommendations. We use Conditional Variational Autoencoder (CVAE) architecture, where both the encoder and decoder are conditioned on a user profile learned from item content data. This allows us to apply style transfer methodologies to the task of recommendations, which we refer to as injection. To enable style injection, user profiles are learned to be interpretable such that they express users' propensities for specific predefined styles. These are learned via label-propagation from a dataset of item content, with limited labeled points. To perform injection, the condition on the encoder is learned while the condition on the decoder is selected per explicit feedback. Explicit feedback can be taken either from a user's response to a style or interest quiz, or from item ratings. In the absence of explicit feedback, the condition at the encoder is applied to the decoder. We show a 12\% improvement on NDCG@20 over the traditional VAE based approach on the task of recommendations. We show an average 22\% improvement on AUC across all classes for predicting user style profiles against our best performing baseline. After injecting styles we compare the user style profile to the style of the recommendations and show that injected styles have an average +133\% increase in presence. Our results show that style injection is a powerful method to diversify recommendations while maintaining personal relevance. Our main contribution is an application of a semi-supervised approach that extends item labels to interpretable user profiles.",https://doi.org/10.1145/3298689.3347007,"collaborative filtering, product recommendation, style transfer, variational autoencoders",recsys2019.bib
