Leveraging post-click feedback for content recommendations,"Wen, Hongyi and Yang, Longqi and Estrin, Deborah",RECSYS,2019,"Implicit feedback (e.g., clicks) is widely used in content recommendations. However, clicks only reflect user preferences according to their first impressions. They do not capture the extent to which users continue to engage with the content. Our analysis shows that more than half of the clicks on music and short videos are followed by skips from two real-world datasets. In this paper, we leverage post-click feedback, e.g. skips and completions, to improve the training and evaluation of content recommenders. Specifically, we experiment with existing collaborative filtering algorithms and find that they perform poorly against post-click-aware ranking metrics. Based on these insights, we develop a generic probabilistic framework to fuse click and post-click signals. We show how our framework can be applied to improve pointwise and pairwise recommendation models. Our approach is shown to outperform existing methods by 18.3\% and 2.5\% respectively in terms of Area Under the Curve (AUC) on the short-video and music dataset. We discuss the effectiveness of our approach across content domains and trade-offs in weighting various user feedback signals.",https://doi.org/10.1145/3298689.3347037,"collaborative filtering, content recommendation, implicit feedback, user modeling",recsys2019.bib
When actions speak louder than clicks: a combined model of purchase probability and long-term customer satisfaction,"Lavee, Gal and Koenigstein, Noam and Barkan, Oren",RECSYS,2019,"Maximizing sales and revenue is an important goal of online commercial retailers. Recommender systems are designed to maximize users' click or purchase probability, but often disregard users' eventual satisfaction with purchased items. As result, such systems promote items with high appeal at the selling stage (e.g. an eyecatching presentation) over items that would yield more satisfaction to users in the long run. This work presents a novel unified model that considers both goals and can be tuned to balance between them according to the needs of the business scenario.We propose a multi-task probabilistic matrix factorization model with a dual task objective: predicting binary purchase/no purchase variables combined with predicting continuous satisfaction scores. Model parameters are optimized using Variational Bayes which allows learning a posterior distribution over model parameters. This model allows making predictions that balance the two goals of maximizing the probability for an immediate purchase and maximizing user satisfaction and engagement down the line. These goals lie at the heart of most commercial recommendation scenarios and enabling their balance has the potential to improve value for millions of users worldwide. Finally, we present experimental evaluation on different types of consumer retail datasets that demonstrate the benefits of the model over popular baselines on a number of well-known ranking metrics.",https://doi.org/10.1145/3298689.3347044,"continuous implicit data, recommendations, variational methods",recsys2019.bib
Uplift-based evaluation and optimization of recommenders,"Sato, Masahiro and Singh, Janmajay and Takemori, Sho and Sonoda, Takashi and Zhang, Qian and Ohkuma, Tomoko",RECSYS,2019,"Recommender systems aim to increase user actions such as clicks and purchases. Typical evaluations of recommenders regard the purchase of a recommended item as a success. However, the item may have been purchased even without the recommendation. An uplift is defined as an increase in user actions caused by recommendations. Situations with and without a recommendation cannot both be observed for a specific user-item pair at a given time instance, making uplift-based evaluation and optimization challenging. This paper proposes new evaluation metrics and optimization methods for the uplift in a recommender system. We apply a causal inference framework to estimate the average uplift for the offline evaluation of recommenders. Our evaluation protocol leverages both purchase and recommendation logs under a currently deployed recommender system, to simulate the cases both with and without recommendations. This enables the offline evaluation of the uplift for newly generated recommendation lists. For optimization, we need to define positive and negative samples that are specific to an uplift-based approach. For this purpose, we deduce four classes of items by observing purchase and recommendation logs. We derive the relative priorities among these four classes in terms of the uplift and use them to construct both pointwise and pairwise sampling methods for uplift optimization. Through dedicated experiments with three public datasets, we demonstrate the effectiveness of our optimization methods in improving the uplift.",https://doi.org/10.1145/3298689.3347018,"causal inference, counterfactual analysis, recommendation effect",recsys2019.bib
Deep social collaborative filtering,"Fan, Wenqi and Ma, Yao and Yin, Dawei and Wang, Jianping and Tang, Jiliang and Li, Qing",RECSYS,2019,"Recommender systems are crucial to alleviate the information overload problem in online worlds. Most of the modern recommender systems capture users' preference towards items via their interactions based on collaborative filtering techniques. In addition to the user-item interactions, social networks can also provide useful information to understand users' preference as suggested by the social theories such as homophily and influence. Recently, deep neural networks have been utilized for social recommendations, which facilitate both the user-item interactions and the social network information. However, most of these models cannot take full advantage of the social network information. They only use information from direct neighbors, but distant neighbors can also provide helpful information. Meanwhile, most of these models treat neighbors' information equally without considering the specific recommendations. However, for a specific recommendation case, the information relevant to the specific item would be helpful. Besides, most of these models do not explicitly capture the neighbor's opinions to items for social recommendations, while different opinions could affect the user differently. In this paper, to address the aforementioned challenges, we propose DSCF, a Deep Social Collaborative Filtering framework, which can exploit the social relations with various aspects for recommender systems. Comprehensive experiments on two-real world datasets show the effectiveness of the proposed framework.",https://doi.org/10.1145/3298689.3347011,"neural networks, random walk, recommender systems, recurrent neural network, social network, social recommendation",recsys2019.bib
Attribute-aware non-linear co-embeddings of graph features,"Rashed, Ahmed and Grabocka, Josif and Schmidt-Thieme, Lars",RECSYS,2019,"In very sparse recommender data sets, attributes of users such as age, gender and home location and attributes of items such as, in the case of movies, genre, release year, and director can improve the recommendation accuracy, especially for users and items that have few ratings. While most recommendation models can be extended to take attributes of users and items into account, their architectures usually become more complicated. While attributes for items are often easy to be provided, attributes for users are often scarce for reasons of privacy or simply because they are not relevant to the operational process at hand. In this paper, we address these two problems for attribute-aware recommender systems by proposing a simple model that co-embeds users and items into a joint latent space in a similar way as a vanilla matrix factorization, but with non-linear latent features construction that seamlessly can ingest user or item attributes or both (GraphRec). To address the second problem, scarce attributes, the proposed model treats the user-item relation as a bipartite graph and constructs generic user and item attributes via the Laplacian of the user-item co-occurrence graph that requires no further external side information but the mere rating matrix. In experiments on three recommender datasets, we show that GraphRec significantly outperforms existing state-of-the-art attribute-aware and content-aware recommender systems even without using any side information.",https://doi.org/10.1145/3298689.3346999,"collaborative filtering, graph embedding, non-linear factorization machines, recommender systems",recsys2019.bib
Adversarial attacks on an oblivious recommender,"Christakopoulou, Konstantina and Banerjee, Arindam",RECSYS,2019,"Can machine learning models be easily fooled? Despite the recent surge of interest in learned adversarial attacks in other domains, in the context of recommendation systems this question has mainly been answered using hand-engineered fake user profiles. This paper attempts to reduce this gap. We provide a formulation for learning to attack a recommender as a repeated general-sum game between two players, i.e., an adversary and a recommender oblivious to the adversary's existence. We consider the challenging case of poisoning attacks, which focus on the training phase of the recommender model. We generate adversarial user profiles targeting subsets of users or items, or generally the top-K recommendation quality. Moreover, we ensure that the adversarial user profiles remain unnoticeable by preserving proximity of the real user rating/interaction distribution to the adversarial fake user distribution. To cope with the challenge of the adversary not having access to the gradient of the recommender's objective with respect to the fake user profiles, we provide a non-trivial algorithm building upon zero-order optimization techniques. We offer a wide range of experiments, instantiating the proposed method for the case of the classic popular approach of a low-rank recommender, and illustrating the extent of the recommender's vulnerability to a variety of adversarial intents. These results can serve as a motivating point for more research into recommender defense strategies against machine learned attacks.",https://doi.org/10.1145/3298689.3347031,"learned adversarial attacks, recommender systems",recsys2019.bib
HybridSVD: when collaborative information is not enough,"Frolov, Evgeny and Oseledets, Ivan",RECSYS,2019,"We propose a new hybrid algorithm that allows incorporating both user and item side information within the standard collaborative filtering technique. One of its key features is that it naturally extends a simple PureSVD approach and inherits its unique advantages, such as highly efficient Lanczos-based optimization procedure, simplified hyper-parameter tuning and a quick folding-in computation for generating recommendations instantly even in highly dynamic online environments. The algorithm utilizes a generalized formulation of the singular value decomposition, which adds flexibility to the solution and allows imposing the desired structure on its latent space. Conveniently, the resulting model also admits an efficient and straightforward solution for the cold start scenario. We evaluate our approach on a diverse set of datasets and show its superiority over similar classes of hybrid models.",https://doi.org/10.1145/3298689.3347055,"PureSVD, cold start, collaborative filtering, hybrid recommenders, matrix factorization, top-n recommendation",recsys2019.bib
Variational low rank multinomials for collaborative filtering with side-information,"Elahi, Ehtsham and Wang, Wei and Ray, Dave and Fenton, Aish and Jebara, Tony",RECSYS,2019,"We are interested in Bayesian models for collaborative filtering that incorporate side-information or metadata about items in addition to user-item interaction data. We present a simple and flexible framework to build models for this task that exploit the low-rank structure in user-item interaction datasets. Although the resulting models are non-conjugate, we develop an efficient technique for approximating posteriors over model parameters using variational inference. We borrow the ""re-parameterization trick"" from Bayesian deep learning literature to enable variational inference in our models. The resulting approximate Bayesian inference algorithm is scalable and can handle large scale datasets. We demonstrate our ideas on three real world datasets where we show competitive performance against widely used baselines.",https://doi.org/10.1145/3298689.3347036,"side-information, variational inference, collaborative filtering",recsys2019.bib
Quick and accurate attack detection in recommender systems through user attributes,"Aktukmak, Mehmet and Yilmaz, Yasin and Uysal, Ismail",RECSYS,2019,"Malicious profiles have been a credible threat to collaborative recommender systems. Attackers provide fake item ratings to systematically manipulate the platform. Attack detection algorithms can identify and remove such users by observing rating distributions. In this study, we aim to use the user attributes as an additional information source to improve the accuracy and speed of attack detection. We propose a probabilistic factorization model which can embed mixed data type user attributes and observed ratings into a latent space to generate anomaly statistics for new users. To identify the persistent outliers in the system, we also propose a sequential attack detection algorithm to enable quick and accurate detection based on the probabilistic model learned from genuine users. The proposed model demonstrates significant improvements in both accuracy and speed when compared to baseline algorithms on a popular benchmark dataset.",https://doi.org/10.1145/3298689.3347050,"attribute embedding, probabilistic matrix factorization, sequential attack detection",recsys2019.bib
A generative model for review-based recommendations,"Shalom, Oren Sar and Uziel, Guy and Kantor, Amir",RECSYS,2019,"User generated reviews is a highly informative source of information, that has recently gained lots of attention in the recommender systems community. In this work we propose a generative latent variable model that explains both observed ratings and textual reviews. This latent variable model allows to combine any traditional collaborative filtering method, together with any deep learning architecture for text processing. Experimental results on four benchmark datasets demonstrate its superiority comparing to all baseline recommender systems. Furthermore, a running time analysis shows that this approach is in order of magnitude faster that relevant baselines. Moreover, underlying our solution there is a general framework that may be further explored.",https://doi.org/10.1145/3298689.3347061,"collaborative filtering, recommender systems, user reviews",recsys2019.bib
A simple multi-armed nearest-neighbor bandit for interactive recommendation,"Sanz-Cruzado, Javier and Castells, Pablo and L\'{o}pez, Esther",RECSYS,2019,"The cyclic nature of the recommendation task is being increasingly taken into account in recommender systems research. In this line, framing interactive recommendation as a genuine reinforcement learning problem, multi-armed bandit approaches have been increasingly considered as a means to cope with the dual exploitation/exploration goal of recommendation. In this paper we develop a simple multi-armed bandit elaboration of neighbor-based collaborative filtering. The approach can be seen as a variant of the nearest-neighbors scheme, but endowed with a controlled stochastic exploration capability of the users' neighborhood, by a parameter-free application of Thompson sampling. Our approach is based on a formal development and a reasonably simple design, whereby it aims to be easy to reproduce and further elaborate upon. We report experiments using datasets from different domains showing that neighbor-based bandits indeed achieve recommendation accuracy enhancements in the mid to long run.",https://doi.org/10.1145/3298689.3347040,"Thompson sampling, interactive recommendation, multi-armed bandits, nearest-neighbors",recsys2019.bib
Adversarial tensor factorization for context-aware recommendation,"Chen, Huiyuan and Li, Jing",RECSYS,2019,"Contextual factors such as time, location, or tag, can affect user preferences for a particular item. Context-aware recommendations are thus critical to improve both quality and explainability of recommender systems, compared to traditional recommendations that are solely based on user-item interactions. Tensor factorization machines have achieved the state-of-the-art performance due to their capability of integrating users, items, and contextual factors in one unify way. However, few work has focused on the robustness of a context-aware recommender system. Improving the robustness of a tensor-based model is challenging due to the sparsity of the observed tensor and the multi-linear nature of tensor factorization. In this paper, we propose ATF, a model that combines tensor factorization and adversarial learning for context-aware recommendations. Doing so allows us to reap the benefits of tensor factorization, while enhancing the robustness of a recommender model, and thus improves its eventual performance. Empirical studies on two real-world datasets show that the proposed method outperforms standard tensor-based methods.",https://doi.org/10.1145/3298689.3346987,"adversarial learning, collaborative filtering, context-ware recommendation, deep learning, tensor factorization",recsys2019.bib
Aligning daily activities with personality: towards a recommender system for improving wellbeing,"Khwaja, Mohammed and Ferrer, Miquel and Iglesias, Jesus Omana and Faisal, A. Aldo and Matic, Aleksandar",RECSYS,2019,"Recommender Systems have not been explored to a great extent for improving health and subjective wellbeing. Recent advances in mobile technologies and user modelling present the opportunity for delivering such systems, however the key issue is understanding the drivers of subjective wellbeing at an individual level. In this paper we propose a novel approach for deriving personalized activity recommendations to improve subjective wellbeing by maximizing the congruence between activities and personality traits. To evaluate the model, we leveraged a rich dataset collected in a smartphone study, which contains three weeks of daily activity probes, the Big-Five personality questionnaire and subjective wellbeing surveys. We show that the model correctly infers a range of activities that are 'good' or 'bad' (i.e. that are positively or negatively related to subjective wellbeing) for a given user and that the derived recommendations greatly match outcomes in the real-world.",https://doi.org/10.1145/3298689.3347020,"activity recommender, personality traits, subjective wellbeing",recsys2019.bib
Asymmetric Bayesian personalized ranking for one-class collaborative filtering,"Ouyang, Shan and Li, Lin and Pan, Weike and Ming, Zhong",RECSYS,2019,"In this paper, we propose a novel preference assumption for modeling users' one-class feedback such as ""thumb up"" in an important recommendation problem called one-class collaborative filtering (OCCF). Specifically, we address a fundamental limitation of a recent symmetric pairwise preference assumption and propose a novel and first asymmetric one, which is able to make the preferences of different users more comparable. With the proposed asymmetric pairwise preference assumption, we further design a novel recommendation algorithm called asymmetric Bayesian personalized ranking (ABPR). Extensive empirical studies on two large and public datasets show that our ABPR performs significantly better than several state-of-the-art recommendation methods with either pointwise preference assumption or pairwise preference assumption.",https://doi.org/10.1145/3298689.3347051,"Bayesian personalized ranking, asymmetric pairwise preference assumption, one-class collaborative filtering",recsys2019.bib
Attribute-based evaluation for recommender systems: incorporating user and item attributes in evaluation metrics,"S\'{a}nchez, Pablo and Bellog\'{\i}n, Alejandro",RECSYS,2019,"Research in Recommender Systems evaluation remains critical to study the efficiency of developed algorithms. Even if different aspects have been addressed and some of its shortcomings - such as biases, robustness, or cold start - have been analyzed and solutions or guidelines have been proposed, there are still some gaps that need to be further investigated. At the same time, the increasing amount of data collected by most recommender systems allows to gather valuable information from users and items which is being neglected by classical offline evaluation metrics. In this work, we integrate such information into the evaluation process in two complementary ways: on the one hand, we aggregate any evaluation metric according to the groups defined by the user attributes, and, on the other hand, we exploit item attributes to consider some recommended items as surrogates of those interacted by the user, with a proper penalization. Our results evidence that this novel evaluation methodology allows to capture different nuances of the algorithms performance, inherent biases in the data, and even fairness of the recommendations.",https://doi.org/10.1145/3298689.3347049,"evaluation, ranking metrics, relevance, top-n recommendation",recsys2019.bib
Combining text summarization and aspect-based sentiment analysis of users' reviews to justify recommendations,"Musto, Cataldo and Rossiello, Gaetano and de Gemmis, Marco and Lops, Pasquale and Semeraro, Giovanni",RECSYS,2019,"In this paper we present a methodology to justify recommendations that relies on the information extracted from users' reviews discussing the available items. The intuition behind the approach is to conceive the justification as a summary of the most relevant and distinguishing aspects of the item, automatically obtained by analyzing its reviews. To this end, we designed a pipeline of natural language processing techniques including aspect extraction, sentiment analysis and text summarization to gather the reviews, process the relevant excerpts, and generate a unique synthesis presenting the main characteristics of the item. Such a summary is finally presented to the target user as a justification of the received recommendation. In the experimental evaluation we carried out a user study in the movie domain (N=141) and the results showed that our approach is able to make the recommendation process more transparent, engaging and trustful for the users.",https://doi.org/10.1145/3298689.3347024,"explanation, recommender systems, sentiment analysis, text summarization",recsys2019.bib
Compositional network embedding for link prediction,"Lyu, Tianshu and Sun, Fei and Jiang, Peng and Ou, Wenwu and Zhang, Yan",RECSYS,2019,"Almost all the existing network embedding methods learn to map the node IDs to their corresponding node embeddings. This design principle, however, hinders the existing methods from being applied in real cases. Node ID is not generalizable and, thus, the existing methods have to pay great effort in cold-start problem. The heterogeneous network usually requires extra work to encode node types, as node type is not able to be identified by node ID. Node ID carries rare information, resulting in the criticism that the existing methods are not robust to noise. To address this issue, we introduce Compositional Network Embedding, a general inductive network representation learning framework that generates node embeddings by combining node features based on the ""principle of compositionally"". Instead of directly optimizing an embedding lookup based on arbitrary node IDs, we learn a composition function that infers node embeddings by combining the corresponding node attribute embeddings through a graph-based loss. For evaluation, we conduct the experiments on link prediction under three different settings. The results verified the effectiveness and generalization ability of compositional network embeddings, especially on unseen nodes.",https://doi.org/10.1145/3298689.3347023,network embedding principle of compositionally,recsys2019.bib
Data mining for item recommendation in MOBA games,"Araujo, Vladimir and Rios, Felipe and Parra, Denis",RECSYS,2019,"E-Sports has been positioned as an important activity within MOBA (Multiplayer Online Battle Arena) games in recent years. There is existing research on recommender systems in this topic, but most of it focuses on the character recommendation problem. However, the recommendation of items is also challenging because of its contextual nature, depending on the other characters. We have developed a framework that suggests items for a character based on the match context. The system aims to help players who have recently started the game as well as frequent players to take strategic advantage during a match and to improve their purchasing decision making. By analyzing a dataset of ranked matches through data mining techniques, we can capture purchase dynamic of experienced players to use it to generate recommendations. The results show that our proposed solution yields up to 80\% of mAP, suggesting that the method leverages context information successfully. These results, together with open issues we mention in the paper, call for further research in the area.",https://doi.org/10.1145/3298689.3346986,"MOBA games, data mining, item recommendation",recsys2019.bib
