Deep language-based critiquing for recommender systems,"Wu, Ga and Luo, Kai and Sanner, Scott and Soh, Harold",RECSYS,2019,"Critiquing is a method for conversational recommendation that adapts recommendations in response to user preference feedback regarding item attributes. Historical critiquing methods were largely based on constraint- and utility-based methods for modifying recommendations w.r.t. these critiqued attributes. In this paper, we revisit the critiquing approach from the lens of deep learning based recommendation methods and language-based interaction. Concretely, we propose an end-to-end deep learning framework with two variants that extend the Neural Collaborative Filtering architecture with explanation and critiquing components. These architectures not only predict personalized keyphrases for a user and item but also embed language-based feedback in the latent space that in turn modulates subsequent critiqued recommendations. We evaluate the proposed framework on two recommendation datasets containing user reviews. Empirical results show that our modified NCF approach not only provides a strong baseline recommender and high-quality personalized item keyphrase suggestions, but that it also properly suppresses items predicted to have a critiqued keyphrase. In summary, this paper provides a first step to unify deep recommendation and language-based feedback in what we hope to be a rich space for future research in deep critiquing for conversational recommendation.",https://doi.org/10.1145/3298689.3347009,"conversational recommendation, critiquing, deep learning",recsys2019.bib
Predictability limits in session-based next item recommendation,"J\""{a}rv, Priit",RECSYS,2019,"Session-based recommendations are based on the user's recent actions, for example, the items they have viewed during the current browsing session or the sightseeing places they have just visited. Closely related is sequence-aware recommendation, where the choice of the next item should follow from the sequence of previous actions.We study seven benchmarks for session-based recommendation, covering retail, music and news domains to investigate how accurately user behavior can be predicted from the session histories. We measure the entropy rate of the data and estimate the limit of predictability to be between 44\% and 73\% in the included datasets.We establish some algorithm-specific limits on prediction accuracy for Markov chains, association rules and k-nearest neighbors methods. With most of the analyzed methods, the algorithm design limits their performance with sparse training data. The session based k-nearest neighbors are least restricted in comparison and have room for improvement across all of the analyzed datasets.",https://doi.org/10.1145/3298689.3346990,"predictability, session-based recommendation",recsys2019.bib
A comparison of calibrated and intent-aware recommendations,"Kaya, Mesut and Bridge, Derek",RECSYS,2019,"Calibrated and intent-aware recommendation are recent approaches to recommendation that have apparent similarities. Both try, to a certain extent, to cover the user's interests, as revealed by her user profile. In this paper, we compare them in detail. On two datasets, we show the extent to which intent-aware recommendations are calibrated and the extent to which calibrated recommendations are diverse. We consider two ways of defining a user's interests, one based on item features, the other based on subprofiles of the user's profile. We find that defining interests in terms of subprofiles results in highest precision and the best relevance/diversity trade-off. Along the way, we define a new version of calibrated recommendation and three new evaluation metrics.",https://doi.org/10.1145/3298689.3347045,"calibration, diversity, intent-aware",recsys2019.bib
LORE: a large-scale offer recommendation engine with eligibility and capacity constraints,"Makhijani, Rahul and Chakrabarti, Shreya and Struble, Dale and Liu, Yi",RECSYS,2019,"Businesses, such as Amazon, department store chains, home furnishing store chains, Uber, and Lyft, frequently offer deals, product discounts and incentives to drive sales, increase new product acceptance and engage with users. In order to appeal to diverse user groups, these businesses typically design more than one promotion offer but market different ones to different users. For instance, Uber offers a percentage discount in the rides to some users and a low fixed price to others. In this paper, we propose solutions to optimally recommend promotions and items to maximize user conversion constrained by user eligibility and item or offer capacity (limited quantity of items or offers) simultaneously. We achieve this through an offer recommendation model based on Min-Cost Flow network optimization, which enables us to satisfy the constraints within the optimization itself and solve it in polynomial time. We present two approaches that can be used in various settings: single period solution and sequential time period offering. We evaluate these approaches against competing methods using counterfactual evaluation in offline mode. We also discuss three practical aspects that may affect the online performance of constrained optimization: capacity determination, traffic arrival pattern and clustering for large scale setting.",https://doi.org/10.1145/3298689.3347027,"budget constraint, min-cost flow, recommendation systems",recsys2019.bib
FiBiNET: combining feature importance and bilinear feature interaction for click-through rate prediction,"Huang, Tongwen and Zhang, Zhiqi and Zhang, Junlin",RECSYS,2019,"Advertising and feed ranking are essential to many Internet companies such as Facebook and Sina Weibo. Among many real-world advertising and feed ranking systems, click through rate (CTR) prediction plays a central role. There are many proposed models in this field such as logistic regression, tree based models, factorization machine based models and deep learning based CTR models. However, many current works calculate the feature interactions in a simple way such as Hadamard product and inner product and they care less about the importance of features. In this paper, a new model named FiBiNET as an abbreviation for Feature Importance and Bilinear feature Interaction NETwork is proposed to dynamically learn the feature importance and fine-grained feature interactions. On the one hand, the FiBiNET can dynamically learn the importance of features via the Squeeze-Excitation network (SENET) mechanism; on the other hand, it is able to effectively learn the feature interactions via bilinear function. We conduct extensive experiments on two real-world datasets and show that our shallow model outperforms other shallow models such as factorization machine(FM) and field-aware factorization machine(FFM). In order to improve performance further, we combine a classical deep neural network(DNN) component with the shallow model to be a deep model. The deep FiBiNET consistently outperforms the other state-of-the-art deep models such as DeepFM and extreme deep factorization machine(XdeepFM).",https://doi.org/10.1145/3298689.3347043,"CTR prediction, bilinear function, display advertising, factorization machines, neural network, squeeze-excitation network",recsys2019.bib
Domain adaptation in display advertising: an application for partner cold-start,"Aggarwal, Karan and Yadav, Pranjul and Keerthi, S. Sathiya",RECSYS,2019,"Digital advertisements connects partners (sellers) to potentially interested online users. Within the digital advertisement domain, there are multiple platforms, e.g., user re-targeting and prospecting. Partners usually start with re-targeting campaigns and later employ prospecting campaigns to reach out to untapped customer base. There are two major challenges involved with prospecting. The first challenge is successful on-boarding of a new partner on the prospecting platform, referred to as partner cold-start problem. The second challenge revolves around the ability to leverage large amounts of re-targeting data for partner cold-start problem.In this work, we study domain adaptation for the partner cold-start problem. To this end, we propose two domain adaptation techniques, SDA-DANN and SDA-Ranking. SDA-DANN and SDA-Ranking extend domain adaptation techniques for partner cold-start by incorporating sub-domain similarities (product category level information). Through rigorous experiments, we demonstrate that our method SDA-DANN outperforms baseline domain adaptation techniques on real-world dataset, obtained from a major online advertiser. Furthermore, we show that our proposed technique SDA-Ranking outperforms baseline methods for low CTR partners.",https://doi.org/10.1145/3298689.3347004,"cold start, digital advertisement, domain adaptation, prospecting, retargeting",recsys2019.bib
Addressing delayed feedback for continuous training with neural networks in CTR prediction,"Ktena, Sofia Ira and Tejani, Alykhan and Theis, Lucas and Myana, Pranay Kumar and Dilipkumar, Deepak and Husz\'{a}r, Ferenc and Yoo, Steven and Shi, Wenzhe",RECSYS,2019,"One of the challenges in display advertising is that the distribution of features and click through rate (CTR) can exhibit large shifts over time due to seasonality, changes to ad campaigns and other factors. The predominant strategy to keep up with these shifts is to train predictive models continuously, on fresh data, in order to prevent them from becoming stale. However, in many ad systems positive labels are only observed after a possibly long and random delay. These delayed labels pose a challenge to data freshness in continuous training: fresh data may not have complete label information at the time they are ingested by the training algorithm. Naive strategies which consider any data point a negative example until a positive label becomes available tend to underestimate CTR, resulting in inferior user experience and suboptimal performance for advertisers. The focus of this paper is to identify the best combination of loss functions and models that enable large-scale learning from a continuous stream of data in the presence of delayed labels. In this work, we compare 5 different loss functions, 3 of them applied to this problem for the first time. We benchmark their performance in offline settings on both public and proprietary datasets in conjunction with shallow and deep model architectures. We also discuss the engineering cost associated with implementing each loss function in a production environment. Finally, we carried out online experiments with the top performing methods, in order to validate their performance in a continuous training scheme. While training on 668 million in-house data points offline, our proposed methods outperform previous state-of-the-art by 3\% relative cross entropy (RCE). During online experiments, we observed 55\% gain in revenue per thousand requests (RPMq) against naive log loss.",https://doi.org/10.1145/3298689.3347002,"delayed feedback, fake negatives, recommender systems",recsys2019.bib
Ghosting: contextualized inline query completion in large scale retail search,"Ramachandran, Lakshmi and Murthy, Uma",RECSYS,2019,"Query auto-completion presents a ranked list of queries as suggestions for a user-entered prefix. Ghosting is the process of auto-completing a search recommendation by highlighting the suggested text inline within the search box. We propose the use of a behavior-based recommendation model along with customer search context to ghost on high-confidence queries. We tested ghosting on a retail production system, on over 140 million search sessions. We found that session-context based ghosting significantly increased the acceptance of offered suggestions by 6.18\%, reduced misspellings among searches by 4.42\%, and improved net sales by 0.14\%.",https://doi.org/10.1145/3298689.3346995,"auto-complete, query suggestion, retail search, session context",recsys2019.bib
Collective embedding for neural context-aware recommender systems,"Costa, Felipe Soares da and Dolog, Peter",RECSYS,2019,"Context-aware recommender systems consider contextual features as additional information to predict user's preferences. For example, the recommendations could be based on time, location, or the company of other people. Among the contextual information, time became an important feature because user preferences tend to change over time or be similar in the near future. Researchers have proposed different models to incorporate time into their recommender system, however, the current models are not able to capture specific temporal patterns. To address the limitation observed in previous works, we propose Collective embedding for Neural Context-Aware Recommender Systems (CoNCARS). The proposed solution jointly model the item, user and time embeddings to capture temporal patterns. Then, CoNCARS use the outer product to model the user-item-time correlations between dimensions of the embedding space. The hidden features feed our Convolutional Neural Networks (CNNs) to learn the non-linearities between the different features. Finally, we combine the output from our CNNs in the fusion layer and then predict the user's preference score. We conduct extensive experiments on real-world datasets, demonstrating CoNCARS improves the top-N item recommendation task and outperform the state-of-the-art recommendation methods.",https://doi.org/10.1145/3298689.3347028,"collective embedding, context-aware recommender systems, convolutional neural networks, time-aware recommendations",recsys2019.bib
A recommender system for heterogeneous and time sensitive environment,"Wu, Meng and Zhu, Ying and Yu, Qilian and Rajendra, Bhargav and Zhao, Yunqi and Aghdaie, Navid and Zaman, Kazi A.",RECSYS,2019,"The digital game industry has recently adopted recommender systems to deliver the most relevant content and suggest the most suitable activities to players. Because of diverse game designs and dynamic experiences, recommender systems typically operate in highly heterogeneous and time-sensitive environments. In this paper, we describe a recommender system at a digital game company which aims to provide recommendations for a large variety of use-cases while being easy to integrate and operate. The system leverages a unified data platform, standardized context and tracking data pipelines, robust naive linear contextual multi-armed bandit algorithms, and experimentation platform for extensibility as well as flexibility. Several games and applications have successfully launched with the recommender system and have achieved significant improvements.",https://doi.org/10.1145/3298689.3347039,"digital game, feature embedding, multi-armed bandits, recommender system",recsys2019.bib
Latent factor models and aggregation operators for collaborative filtering in reciprocal recommender systems,"Neve, James and Palomares, Ivan",RECSYS,2019,"Online dating platforms help to connect people who might potentially be a good match for each other. They have exerted a significant societal impact over the last decade, such that about one third of new relationships in the US are now started online, for instance. Recommender Systems are widely utilized in online platforms that connect people to people in e.g. online dating and recruitment sites. These recommender approaches are fundamentally different from traditional user-item approaches (such as those operating on movie and shopping sites), in that they must consider the interests of both parties jointly. Latent factor models have been notably successful in the area of user-item recommendation, however they have not been investigated within user-to-user domains as of yet. In this study, we present a novel method for reciprocal recommendation using latent factor models. We also provide a first analysis of the use of different preference aggregation strategies, thereby demonstrating that the aggregation function used to combine user preference scores has a significant impact on the outcome of the recommender system. Our evaluation results report significant improvements over previous nearest-neighbour and content-based methods for reciprocal recommendation, and show that the latent factor model can be used effectively on much larger datasets than previous state-of-the-art reciprocal recommender systems.",https://doi.org/10.1145/3298689.3347026,"latent factor models, online dating, preference aggregation, reciprocal recommender systems",recsys2019.bib
CB2CF: a neural multiview content-to-collaborative filtering model for completely cold item recommendations,"Barkan, Oren and Koenigstein, Noam and Yogev, Eylon and Katz, Ori",RECSYS,2019,"In Recommender Systems research, algorithms are often characterized as either Collaborative Filtering (CF) or Content Based (CB). CF algorithms are trained using a dataset of user preferences while CB algorithms are typically based on item profiles. These approaches harness different data sources and therefore the resulting recommended items are generally very different. This paper presents the CB2CF, a deep neural multiview model that serves as a bridge from items content into their CF representations. CB2CF is a ""real-world"" algorithm designed for Microsoft Store services that handle around a billion users worldwide. CB2CF is demonstrated on movies and apps recommendations, where it is shown to outperform an alternative CB model on completely cold items.",https://doi.org/10.1145/3298689.3347038,"cold item recommendations, multiview representation learning",recsys2019.bib
Online learning to rank for sequential music recommendation,"Pereira, Bruno L. and Ueda, Alberto and Penha, Gustavo and Santos, Rodrygo L. T. and Ziviani, Nivio",RECSYS,2019,"The prominent success of music streaming services has brought increasingly complex challenges for music recommendation. In particular, in a streaming setting, songs are consumed sequentially within a listening session, which should cater not only for the user's historical preferences, but also for eventual preference drifts, triggered by a sudden change in the user's context. In this paper, we propose a novel online learning to rank approach for music recommendation aimed to continuously learn from the user's listening feedback. In contrast to existing online learning approaches for music recommendation, we leverage implicit feedback as the only signal of the user's preference. Moreover, to adapt rapidly to preference drifts over millions of songs, we represent each song in a lower dimensional feature space and explore multiple directions in this space as duels of candidate recommendation models. Our thorough evaluation using listening sessions from Last.fm demonstrates the effectiveness of our approach at learning faster and better compared to state-of-the-art online learning approaches.",https://doi.org/10.1145/3298689.3347019,"implicit feedback, music recommendation, online learning to rank",recsys2019.bib
Pace my race: recommendations for marathon running,"Berndsen, Jakim and Smyth, Barry and Lawlor, Aonghus",RECSYS,2019,"We propose marathon running as a novel domain for recommender systems and machine learning. Using high-resolution marathon performance data from multiple marathon races (n = 7931), we build in-race recommendations for runners. We show that we can outperform the existing techniques which are currently employed for in-race finish-time prediction, and we demonstrate how such predictions may be used to make real time recommendations to runners. The recommendations are made at critical points in the race to provide personalised guidance so the runner can adjust their race strategy. Through the association of model features and the expert domain knowledge of marathon runners we generate explainable, adaptable pacing recommendations which can guide runners to their best possible finish time and help them avoid the potentially catastrophic effects of hitting the wall.",https://doi.org/10.1145/3298689.3346991,"marathon pacing, recommender systems, running, sports analytics",recsys2019.bib
Efficient similarity computation for collaborative filtering in dynamic environments,"Jeunen, Olivier and Verstrepen, Koen and Goethals, Bart",RECSYS,2019,"The problem of computing all pairwise similarities in a large collection of vectors is a well-known and common data mining task. As the number and dimensionality of these vectors keeps increasing, however, currently existing approaches are often unable to meet the strict efficiency requirements imposed by the environments they need to perform in. Real-time neighbourhood-based collaborative filtering (CF) is one example of such an environment in which performance is critical.In this work, we present a novel algorithm for efficient and exact similarity computation between sparse, high-dimensional vectors. Our approach exploits the sparsity that is inherent to implicit feedback data-streams, entailing significant gains compared to other methods. Furthermore, as our model learns incrementally, it is naturally suited for dynamic real-time CF environments. We propose a MapReduce-inspired parallellisation procedure along with our method, and show how even more speed-up can be achieved. Additionally, in many real-world systems, many items are actually not recommendable at any given time, due to recency, stock, seasonality, or enforced business rules. We exploit this fact to further improve the computational efficiency of our approach. Experimental evaluation on both real-world and publicly available datasets shows that our approach scales up to millions of processed user-item interactions per second, and well advances the state-of-the-art.",https://doi.org/10.1145/3298689.3347017,"distributed algorithms, incremental algorithms, nearest-neighbours",recsys2019.bib
Personalized diffusions for top-n recommendation,"Nikolakopoulos, Athanasios N. and Berberidis, Dimitris and Karypis, George and Giannakis, Georgios B.",RECSYS,2019,"This paper introduces PerDif; a novel framework for learning personalized diffusions over item-to-item graphs for top-n recommendation. PerDif learns the teleportation probabilities of a time-inhomogeneous random walk with restarts capturing a user-specific underlying item exploration process. Such an approach can lead to significant improvements in recommendation accuracy, while also providing useful information about the users in the system. Per-user fitting can be performed in parallel and very efficiently even in large-scale settings. A comprehensive set of experiments on real-world datasets demonstrate the scalability as well as the qualitative merits of the proposed framework. PerDif achieves high recommendation accuracy, outperforming state-of-the-art competing approaches---including several recently proposed methods relying on deep neural networks.",https://doi.org/10.1145/3298689.3346985,"item models, random walks, top-n recommendation",recsys2019.bib
Sampling-bias-corrected neural modeling for large corpus item recommendations,"Yi, Xinyang and Yang, Ji and Hong, Lichan and Cheng, Derek Zhiyuan and Heldt, Lukasz and Kumthekar, Aditee and Zhao, Zhe and Wei, Li and Chi, Ed",RECSYS,2019,"Many recommendation systems retrieve and score items from a very large corpus. A common recipe to handle data sparsity and power-law item distribution is to learn item representations from its content features. Apart from many content-aware systems based on matrix factorization, we consider a modeling framework using two-tower neural net, with one of the towers (item tower) encoding a wide variety of item content features. A general recipe of training such two-tower models is to optimize loss functions calculated from in-batch negatives, which are items sampled from a random mini-batch. However, in-batch loss is subject to sampling biases, potentially hurting model performance, particularly in the case of highly skewed distribution. In this paper, we present a novel algorithm for estimating item frequency from streaming data. Through theoretical analysis and simulation, we show that the proposed algorithm can work without requiring fixed item vocabulary, and is capable of producing unbiased estimation and being adaptive to item distribution change. We then apply the sampling-bias-corrected modeling approach to build a large scale neural retrieval system for YouTube recommendations. The system is deployed to retrieve personalized suggestions from a corpus with tens of millions of videos. We demonstrate the effectiveness of sampling-bias correction through offline experiments on two real-world datasets. We also conduct live A/B testings to show that the neural retrieval system leads to improved recommendation quality for YouTube.",https://doi.org/10.1145/3298689.3346996,"information retrieval, neural networks, recommender systems",recsys2019.bib
