DualDiv: diversifying items and explanation styles in explainable hybrid recommendation,"Tsukuda, Kosetsu and Goto, Masataka",RECSYS,2019,"In recommender systems, item diversification and explainable recommendations improve users' satisfaction. Unlike traditional explainable recommendations that display a single explanation for each item, explainable hybrid recommendations display multiple explanations for each item and are, therefore, more beneficial for users. When multiple explanations are displayed, one problem is that similar sets of explanation styles (ESs) such as user-based, item-based, and popularity-based may be displayed for similar items. Although item diversification has been studied well, the question of how to diversify the ESs remains underexplored. In this paper, we propose a method for diversifying ESs and a framework, called DualDiv, that recommends items by diversifying both the items and the ESs. Our experimental results show that DualDiv can increase the diversity of the items and the ESs without largely reducing the recommendation accuracy.",https://doi.org/10.1145/3298689.3347063,"diversity, explainable recommendations, recommender systems",recsys2019.bib
Enhancing VAEs for collaborative filtering: flexible priors \&amp; gating mechanisms,"Kim, Daeryong and Suh, Bongwon",RECSYS,2019,"Neural network based models for collaborative filtering have started to gain attention recently. One branch of research is based on using deep generative models to model user preferences where variational autoencoders were shown to produce state-of-the-art results. However, there are some potentially problematic characteristics of the current variational autoencoder for CF. The first is the too simplistic prior that VAEs incorporate for learning the latent representations of user preference. The other is the model's inability to learn deeper representations with more than one hidden layer for each network.Our goal is to incorporate appropriate techniques to mitigate the aforementioned problems of variational autoencoder CF and further improve the recommendation performance. Our work is the first to apply flexible priors to collaborative filtering and show that simple priors (in original VAEs) may be too restrictive to fully model user preferences and setting a more flexible prior gives significant gains. We experiment with the VampPrior, originally proposed for image generation, to examine the effect of flexible priors in CF. We also show that VampPriors coupled with gating mechanisms outperform SOTA results including the Variational Autoencoder for Collaborative Filtering by meaningful margins on 2 popular benchmark datasets (MovieLens \&amp; Netflix).",https://doi.org/10.1145/3298689.3347015,"deep generative models, neural collaborative filtering, recommender systems, variational autoencoders",recsys2019.bib
Find my next job: labor market recommendations using administrative big data,"Frid-Nielsen, Snorre S.",RECSYS,2019,"Labor markets are undergoing change due to factors such as automatization and globalization, motivating the development of occupational recommender systems for jobseekers and caseworkers. This study generates occupational recommendations by utilizing a novel data set consisting of administrative records covering the entire Danish workforce. Based on actual labor market behavior in the period 2012-2015, how well can different models predict each users' next occupation in 2016? Through offline experiments, the study finds that gradient-boosted decision tree models provide the best recommendations for future occupations in terms of mean reciprocal ranking and recall. Further, gradient-boosted decision tree models offer distinct advantages in the labor market domain due to their interpretability and ability to harness additional background information on workers. However, the study raises concerns regarding trade-offs between model accuracy and ethical issues, including privacy and the social reinforcement of gender divides.",https://doi.org/10.1145/3298689.3346992,"big data, job recommendations, labor market, public sector",recsys2019.bib
Greedy optimized multileaving for personalization,"Iizuka, Kojiro and Yoneda, Takeshi and Seki, Yoshifumi",RECSYS,2019,"Personalization plays an important role in many services. To evaluate personalized rankings, online evaluation, such as A/B testing, is widely used today. Recently, multileaving has been found to be an efficient method for evaluating rankings in information retrieval fields. This paper describes the first attempt to optimize the multileaving method for personalization settings. We clarify the challenges of applying this method to personalized rankings. Then, to solve these challenges, we propose greedy optimized multileaving (GOM) with a new credit feedback function. The empirical results showed that GOM was stable for increasing ranking lengths and the number of rankers. We implemented GOM on our actual news recommender systems, and compared its online performance. The results showed that GOM evaluated the personalized rankings precisely, with significantly smaller sample sizes (&lt; 1/10) than A/B testing.",https://doi.org/10.1145/3298689.3347008,"evaluation of personalized ranking, interleaving and multileaving",recsys2019.bib
Guiding creative design in online advertising,"Mishra, Shaunak and Verma, Manisha and Gligorijevic, Jelena",RECSYS,2019,"Ad creatives (text and images) for a brand play an influential role in online advertising. To design impactful ads, creative strategists employed by the brands (advertisers) typically go through a time consuming process of market research and ideation. Such a process may involve knowing more about the brand, and drawing inspiration from prior successful creatives for the brand, and its competitors in the same product category. To assist strategists towards faster creative development, we introduce a recommender system which provides a list of desirable keywords for a given brand. Such keywords can serve as underlying themes, and guide the strategist in finalizing the image and text for the brand's ad creative. We explore the potential of distributed representations of Wikipedia pages along with a labeled dataset of keywords for 900 brands by using deep relevance matching for recommending a list of keywords for a given brand. Our experiments demonstrate the efficacy of the proposed recommender system over several baselines for relevance matching; although end-to-end automation of ad creative development still remains an open problem in the advertising industry, the proposed recommender system is a stepping stone by providing valuable insights to creative strategists and advertisers.",https://doi.org/10.1145/3298689.3347022,"ad creative, creative design, online advertising, relevance matching",recsys2019.bib
How can they know that? A study of factors affecting the creepiness of recommendations,"Torkamaan, Helma and Barbu, Catalin-Mihai and Ziegler, J\""{u}rgen",RECSYS,2019,"Recommender systems (RS) often use implicit user preferences extracted from behavioral and contextual data, in addition to traditional rating-based preference elicitation, to increase the quality and accuracy of personalized recommendations. However, these approaches may harm user experience by causing mixed emotions, such as fear, anxiety, surprise, discomfort, or creepiness. RS should consider users' feelings, expectations, and reactions that result from being shown personalized recommendations. This paper investigates the creepiness of recommendations using an online experiment in three domains: movies, hotels, and health. We define the feeling of creepiness caused by recommendations and find out that it is already known to users of RS. We further find out that the perception of creepiness varies across domains and depends on recommendation features, like causal ambiguity and accuracy. By uncovering possible consequences of creepy recommendations, we also learn that creepiness can have a negative influence on brand and platform attitudes, purchase or consumption intention, user experience, and users' expectations of---and their trust in---RS.",https://doi.org/10.1145/3298689.3346982,"creepiness, emotion, personalization, recommender systems, trust",recsys2019.bib
Latent multi-criteria ratings for recommendations,"Li, Pan and Tuzhilin, Alexander",RECSYS,2019,"Multi-criteria recommender systems have been increasingly valuable for helping consumers identify the most relevant items based on different dimensions of user experiences. However, previously proposed multi-criteria models did not take into account latent embeddings generated from user reviews, which capture latent semantic relations between users and items. To address these concerns, we utilize variational autoencoders to map user reviews into latent embeddings, which are subsequently compressed into low-dimensional discrete vectors. The resulting compressed vectors constitute latent multi-criteria ratings that we use for the recommendation purposes via standard multi-criteria recommendation methods. We show that the proposed latent multi-criteria rating approach outperforms several baselines significantly and consistently across different datasets and performance evaluation measures.",https://doi.org/10.1145/3298689.3347068,"collaborative filtering, multi-criteria decision making, multi-criteria recommendation system, user preference",recsys2019.bib
Multi-armed recommender system bandit ensembles,"Ca\~{n}amares, Roc\'{\i}o and Redondo, Marcos and Castells, Pablo",RECSYS,2019,"It has long been found that well-configured recommender system ensembles can achieve better effectiveness than the combined systems separately. Sophisticated approaches have been developed to automatically optimize the ensembles' configuration to maximize their performance gains. However most work in this area has targeted simplified scenarios where algorithms are tested and compared on a single non-interactive run. In this paper we consider a more realistic perspective bearing in mind the cyclic nature of the recommendation task, where a large part of the system's input is collected from the reaction of users to the recommendations they are delivered. The cyclic process provides the opportunity for ensembles to observe and learn about the effectiveness of the combined algorithms, and improve the ensemble configuration progressively.In this paper we explore the adaptation of a multi-armed bandit approach to achieve this, by representing the combined systems as arms, and the ensemble as a bandit that at each step selects an arm to produce the next round of recommendations. We report experiments showing the effectiveness of this approach compared to ensembles that lack the iterative perspective. Along the way, we find illustrative pitfall examples that can result from common, single-shot offline evaluation setups.",https://doi.org/10.1145/3298689.3346984,"ensembles, feedback loop, hybrid recommender systems, interactive recommendation, multi-armed bandits",recsys2019.bib
Music recommendations in hyperbolic space: an application of empirical bayes and hierarchical poincar\'{e} embeddings,"Schmeier, Timothy and Chisari, Joeseph and Garrett, Sam and Vintch, Brett",RECSYS,2019,"Matrix Factorization (MF) is a common method for generating recommendations, where the proximity of entities like users or items in the embedded space indicates their similarity to one another. Though almost all applications implicitly use a Euclidean embedding space to represent two entity types, recent work has suggested that a hyperbolic Poincar\'{e} ball may be more well suited to representing multiple entity types, and in particular, hierarchies. We describe a novel method to embed a hierarchy of related music entities in hyperbolic space. We also describe how a parametric empirical Bayes approach can be used to estimate link reliability between entities in the hierarchy. Applying these methods together to build personalized playlists for users in a digital music service yielded a large and statistically significant increase in performance during an A/B test, as compared to the Euclidean model.",https://doi.org/10.1145/3298689.3347029,"hierarchical, hyperbolic, poincare, recommender system",recsys2019.bib
On gossip-based information dissemination in pervasive recommender systems,"Eichinger, Tobias and Beierle, Felix and Papke, Robin and Rebscher, Lucas and Tran, Hong Chinh and Trzeciak, Magdalena",RECSYS,2019,"Pervasive computing systems employ distributed and embedded devices in order to raise, communicate, and process data in an anytime-anywhere fashion. Certainly, its most prominent device is the smartphone due to its wide proliferation, growing computation power, and wireless networking capabilities. In this context, we revisit the implementation of digitalized word-of-mouth that suggests exchanging item preferences between smartphones offline and directly in immediate proximity. Collaboratively and decentrally collecting data in this way has two benefits. First, it allows to attach for instance location-sensitive context information in order to enrich collected item preferences. Second, model building does not require network connectivity. Despite the benefits, the approach naturally raises data privacy and data scarcity issues. In order to address both, we propose Propagate and Filter, a method that translates the traditional approach of finding similar peers and exchanging item preferences among each other from the field of decentralized to that of pervasive recommender systems. Additionally, we present preliminary results on a prototype mobile application that implements the proposed device-to-device information exchange. Average ad-hoc connection delays of 25.9 seconds and reliable connection success rates within 6 meters underpin the approach's technical feasibility.",https://doi.org/10.1145/3298689.3347067,"data privacy, data scarcity, decentralized recommender system, information dissemination, mobile network, opportunistic network, pervasive recommender system",recsys2019.bib
On the discriminative power of hyper-parameters in cross-validation and how to choose them,"Anelli, Vito Walter and Di Noia, Tommaso and Di Sciascio, Eugenio and Pomo, Claudio and Ragone, Azzurra",RECSYS,2019,"Hyper-parameters tuning is a crucial task to make a model perform at its best. However, despite the well-established methodologies, some aspects of the tuning remain unexplored. As an example, it may affect not just accuracy but also novelty as well as it may depend on the adopted dataset. Moreover, sometimes it could be sufficient to concentrate on a single parameter only (or a few of them) instead of their overall set. In this paper we report on our investigation on hyper-parameters tuning by performing an extensive 10-Folds Cross-Validation on MovieLens and Amazon Movies for three well-known baselines: User-kNN, Item-kNN, BPR-MF. We adopted a grid search strategy considering approximately 15 values for each parameter, and we then evaluated each combination of parameters in terms of accuracy and novelty. We investigated the discriminative power of nDCG, Precision, Recall, MRR, EFD, EPC, and, finally, we analyzed the role of parameters on model evaluation for Cross-Validation.",https://doi.org/10.1145/3298689.3347010,"discriminative power, parameter tuning, recommender systems",recsys2019.bib
PAL: a position-bias aware learning framework for CTR prediction in live recommender systems,"Guo, Huifeng and Yu, Jinkai and Liu, Qing and Tang, Ruiming and Zhang, Yuzhou",RECSYS,2019,"Predicting Click-Through Rate (CTR) accurately is crucial in recommender systems. In general, a CTR model is trained based on user feedback which is collected from traffic logs. However, position-bias exists in user feedback because a user clicks on an item may not only because she favors it but also because it is in a good position. One way is to model position as a feature in the training data, which is widely used in industrial applications due to its simplicity. Specifically, a default position value has to be used to predict CTR in online inference since the actual position information is not available at that time. However, using different default position values may result in completely different recommendation results. As a result, this approach leads to sub-optimal online performance. To address this problem, in this paper, we propose a &lt;u&gt;P&lt;/u&gt;osition-bias &lt;u&gt;A&lt;/u&gt;ware &lt;u&gt;L&lt;/u&gt;earning framework (PAL) for CTR prediction in a live recommender system. It is able to model the position-bias in offline training and conduct online inference without position information. Extensive online experiments are conducted to demonstrate that PAL outperforms the baselines by 3\% - 35\% in terms of CTR and CVR (ConVersion Rate) in a three-week AB test.",https://doi.org/10.1145/3298689.3347033,,recsys2019.bib
PDMFRec: a decentralised matrix factorisation with tunable user-centric privacy,"Duriakova, Erika and Tragos, Elias Z. and Smyth, Barry and Hurley, Neil and Pe\~{n}a, Francisco J. and Symeonidis, Panagiotis and Geraci, James and Lawlor, Aonghus",RECSYS,2019,"Conventional approaches to matrix factorisation (MF) typically rely on a centralised collection of user data for building a MF model. This approach introduces an increased risk when it comes to user privacy. In this short paper we propose an alternative, user-centric, privacy enhanced, decentralised approach to MF. Our method pushes the computation of the recommendation model to the user's device, and eliminates the need to exchange sensitive personal information; instead only the loss gradients of local (device-based) MF models need to be shared. Moreover, users can select the amount and type of information to be shared, for enhanced privacy. We demonstrate the effectiveness of this approach by considering different levels of user privacy in comparison with state-of-the-art alternatives.",https://doi.org/10.1145/3298689.3347035,"decentralised matrix factorisation, matrix factorisation, privacy aware, rating prediction",recsys2019.bib
Performance comparison of neural and non-neural approaches to session-based recommendation,"Ludewig, Malte and Mauro, Noemi and Latifi, Sara and Jannach, Dietmar",RECSYS,2019,"The benefits of neural approaches are undisputed in many application areas. However, today's research practice in applied machine learning---where researchers often use a variety of baselines, datasets, and evaluation procedures---can make it difficult to understand how much progress is actually achieved through novel technical approaches. In this work, we focus on the fast-developing area of session-based recommendation and aim to contribute to a better understanding of what represents the state-of-the-art.To that purpose, we have conducted an extensive set of experiments, using a variety of datasets, in which we benchmarked four neural approaches that were published in the last three years against each other and against a set of simpler baseline techniques, e.g., based on nearest neighbors. The evaluation of the algorithms under the exact same conditions revealed that the benefits of applying today's neural approaches to session-based recommendations are still limited. In the majority of the cases, and in particular when precision and recall are used, it turned out that simple techniques in most cases outperform recent neural approaches. Our findings therefore point to certain major limitations of today's research practice. By sharing our evaluation framework publicly, we hope that some of these limitations can be overcome in the future.",https://doi.org/10.1145/3298689.3347041,"evaluation, reproducibility, session-based recommendation",recsys2019.bib
Personalized fairness-aware re-ranking for microlending,"Liu, Weiwen and Guo, Jun and Sonboli, Nasim and Burke, Robin and Zhang, Shengyu",RECSYS,2019,"Microlending can lead to improved access to capital in impoverished countries. Recommender systems could be used in microlending to provide efficient and personalized service to lenders. However, increasing concerns about discrimination in machine learning hinder the application of recommender systems to the microfinance industry. Most previous recommender systems focus on pure personalization, with fairness issue largely ignored. A desirable fairness property in microlending is to give borrowers from different demographic groups a fair chance of being recommended, as stated by Kiva. To achieve this goal, we propose a Fairness-Aware Re-ranking (FAR) algorithm to balance ranking quality and borrower-side fairness. Furthermore, we take into consideration that lenders may differ in their receptivity to the diversification of recommended loans, and develop a Personalized Fairness-Aware Re-ranking (PFAR) algorithm. Experiments on a real-world dataset from Kiva.org show that our re-ranking algorithm can significantly promote fairness with little sacrifice in accuracy, and be attentive to individual lender preference on loan diversity.",https://doi.org/10.1145/3298689.3347016,"fairness-aware re-ranking, loan recommendation, re-ranking",recsys2019.bib
Pick \&amp; merge: an efficient item filtering scheme for Windows store recommendations,"Makmal, Adi and Ephrath, Jonathan and Berezin, Hilik and Allerhand, Liron and Nice, Nir and Koenigstein, Noam",RECSYS,2019,"Microsoft Windows is the most popular operating system (OS) for personal computers (PCs). With hundreds of millions of users, its app marketplace, Windows Store, is one of the largest in the world. As such, special considerations are required in order to improve online computational efficiency and response times.This paper presents the results of an extensive research of effective filtering method for semi-personalized recommendations. The filtering problem, defined here for the first time, addresses an aspect that was so far largely overlooked by the recommender systems literature, namely effective and efficient method for removing items from semi-personalized recommendation lists.Semi-personalized recommendation lists serve a common list to a group of people based on their shared interest or background. Unlike fully personalized lists, these lists are cacheable and constitute the majority of recommendation lists in many online stores.This motivates the following question: can we remove (most of) the users' undesired items without collapsing onto fully personalized recommendations?Our solution is based on dividing the users into few subgroups, such that each subgroup receives a different variant of the original recommendation list. This approach adheres to the principles of semi-personalization and hence preserves simplicity and cacheability. We formalize the problem of finding optimal subgroups that minimize the total number of filtering errors, and show that it is combinatorially formidable. Consequently, a greedy algorithm is proposed that filters out most of the undesired items, while bounding the maximal number of errors for each user. Finally, a detailed evaluation of the proposed algorithm is presented using both proprietary and public datasets.",https://doi.org/10.1145/3298689.3347005,"e-commerce, personalization systems, recommender systems",recsys2019.bib
Predicting online performance of job recommender systems with offline evaluation,"Mogenet, Adrien and Pham, Tuan Anh Nguyen and Kazama, Masahiro and Kong, Jialin",RECSYS,2019,"At Indeed, recommender systems are used to recommend jobs. In this context, implicit and explicit feedback signals we can collect are rare events, making the task of evaluation more complex. Online evaluation (A/B testing) is usually the most reliable way to measure the results from our experiments, but it is a slow process. In contrast, the offline evaluation process is faster, but it is critical to make it reliable as it informs our decision to roll out new improvements in production. In this paper, we review the comparative offline and online performances of three recommendations models, we describe the evaluation metrics we use and analyze how the offline performance metrics correlate with online metrics to understand how an offline evaluation process can be leveraged to inform the decisions.",https://doi.org/10.1145/3298689.3347032,"accuracy metrics, comparative studies, evaluation, statistical analysis",recsys2019.bib
